{
    "schemaVersion":  "1.0.0",
    "workPackage":  "M0-DIA-13",
    "generatedAtUtc":  "2026-07-15T13:56:47.7500325Z",
    "executionStatus":  "InProgress",
    "gateStatus":  "Blocked",
    "blockerCode":  "EvidenceMissing",
    "result":  "Partial",
    "sourceInventoryHash":  "a30d210fb0273323b17c9553e7a9e9bda9879e1c6d1478ffb8ff8325c67ccdc2",
    "sourceCompatibilityPackHash":  "e9ffd09462b7bd4ecf2340d36850604533102b0e5c5bb659a29fe06f88438c46",
    "catalogId":  "gemuera.m0.dialect-declaration-vocabulary",
    "catalogVersion":  "1.0.0",
    "catalogHash":  "4339e61113848c2d7e9f97ed07e647fe8b111a79f231275ba742cfbb2227deda",
    "vocabularySetHash":  "766c3f843f39749010d61b693b1fbef41164ef04bff2ac27e1469e193d5d98c4",
    "declarationCounts":  {
                              "behaviorKeyCount":  10,
                              "capabilityIdCount":  4,
                              "sourceClassificationCount":  30,
                              "branchHitCount":  97
                          },
    "currentCompatibilityPackExposure":  {
                                             "status":  "NoRuntimeCapabilitiesDeclared",
                                             "packCount":  2,
                                             "allowedCapabilityIds":  [

                                                                      ],
                                             "reason":  "DIA-12 static CompatibilityPacks intentionally declare no runtime capability ids; DIA-13 vocabulary candidates cannot be selected yet."
                                         },
    "declarations":  [
                         {
                             "kind":  "BehaviorKey",
                             "id":  "call.extra-arguments.v1",
                             "branchHitCount":  1,
                             "sourceClassificationIds":  [
                                                             "call-extra-arguments-policy"
                                                         ],
                             "targetModuleIds":  [
                                                     "game.snake"
                                                 ],
                             "fixtureIds":  [
                                                "DIA-CALL-EXTRA-001"
                                            ],
                             "declarationStatus":  "StaticCandidate",
                             "currentPackEligibility":  "NotEligible",
                             "runtimeStatus":  "NotImplemented"
                         },
                         {
                             "kind":  "BehaviorKey",
                             "id":  "call.private-argument-shape.v1",
                             "branchHitCount":  1,
                             "sourceClassificationIds":  [
                                                             "private-argument-shape-policy"
                                                         ],
                             "targetModuleIds":  [
                                                     "game.snake"
                                                 ],
                             "fixtureIds":  [
                                                "DIA-CALL-PRIVATE-001"
                                            ],
                             "declarationStatus":  "StaticCandidate",
                             "currentPackEligibility":  "NotEligible",
                             "runtimeStatus":  "NotImplemented"
                         },
                         {
                             "kind":  "BehaviorKey",
                             "id":  "display.history-capacity.v1",
                             "branchHitCount":  3,
                             "sourceClassificationIds":  [
                                                             "content-selected-profile-fallback",
                                                             "content-snake-profile-id",
                                                             "view-history-capacity-policy"
                                                         ],
                             "targetModuleIds":  [
                                                     "game.snake"
                                                 ],
                             "fixtureIds":  [
                                                "DIA-DISPLAY-HISTORY-001"
                                            ],
                             "declarationStatus":  "StaticCandidate",
                             "currentPackEligibility":  "NotEligible",
                             "runtimeStatus":  "NotImplemented"
                         },
                         {
                             "kind":  "BehaviorKey",
                             "id":  "display.refresh-timing.v1",
                             "branchHitCount":  5,
                             "sourceClassificationIds":  [
                                                             "console-refresh-timing-policy"
                                                         ],
                             "targetModuleIds":  [
                                                     "game.snake"
                                                 ],
                             "fixtureIds":  [
                                                "DIA-DISPLAY-TIMING-001"
                                            ],
                             "declarationStatus":  "StaticCandidate",
                             "currentPackEligibility":  "NotEligible",
                             "runtimeStatus":  "NotImplemented"
                         },
                         {
                             "kind":  "BehaviorKey",
                             "id":  "function.snake-fallen-state.v1",
                             "branchHitCount":  1,
                             "sourceClassificationIds":  [
                                                             "snake-fallen-function-policy"
                                                         ],
                             "targetModuleIds":  [
                                                     "game.snake"
                                                 ],
                             "fixtureIds":  [
                                                "DIA-FUNC-FALLEN-001"
                                            ],
                             "declarationStatus":  "StaticCandidate",
                             "currentPackEligibility":  "NotEligible",
                             "runtimeStatus":  "NotImplemented"
                         },
                         {
                             "kind":  "BehaviorKey",
                             "id":  "instruction.scoped-variable-registration.v1",
                             "branchHitCount":  13,
                             "sourceClassificationIds":  [
                                                             "scoped-variable-config-schema",
                                                             "scoped-variable-registration-guard"
                                                         ],
                             "targetModuleIds":  [
                                                     "game.snake"
                                                 ],
                             "fixtureIds":  [
                                                "DIA-REG-SCOPEDVAR-001"
                                            ],
                             "declarationStatus":  "StaticCandidate",
                             "currentPackEligibility":  "NotEligible",
                             "runtimeStatus":  "NotImplemented"
                         },
                         {
                             "kind":  "BehaviorKey",
                             "id":  "parser.startup-fault.v1",
                             "branchHitCount":  1,
                             "sourceClassificationIds":  [
                                                             "startup-fault-policy"
                                                         ],
                             "targetModuleIds":  [
                                                     "game.snake"
                                                 ],
                             "fixtureIds":  [
                                                "DIA-PARSER-FAULT-001"
                                            ],
                             "declarationStatus":  "StaticCandidate",
                             "currentPackEligibility":  "NotEligible",
                             "runtimeStatus":  "NotImplemented"
                         },
                         {
                             "kind":  "BehaviorKey",
                             "id":  "parser.user-variable-resolution.v1",
                             "branchHitCount":  4,
                             "sourceClassificationIds":  [
                                                             "expression-user-variable-policy",
                                                             "header-user-variable-policy"
                                                         ],
                             "targetModuleIds":  [
                                                     "game.snake"
                                                 ],
                             "fixtureIds":  [
                                                "DIA-PARSER-USERVAR-001"
                                            ],
                             "declarationStatus":  "StaticCandidate",
                             "currentPackEligibility":  "NotEligible",
                             "runtimeStatus":  "NotImplemented"
                         },
                         {
                             "kind":  "BehaviorKey",
                             "id":  "parser.warning-routing.v1",